{
  "contract_version": 2,
  "generated_at": "2026-07-08T12:00:00Z",
  "project": "ih_market_companion",
  "workflow": "market_pipeline",
  "workflow_id": "ih_market_companion/market_pipeline",
  "run_id": "d4e5f6a7-58cc-4372-a567-0e02b2c3d479",
  "status": "ok",
  "started_at": "2026-07-08T11:55:00Z",
  "finished_at": "2026-07-08T11:58:00Z",
  "last_success_at": "2026-07-08T11:58:00Z",
  "expected_cadence_seconds": 3600,
  "freshness_seconds": 120,
  "records_read": null,
  "records_written": null,
  "records_rejected": null,
  "backlog": null,
  "retry_count": null,
  "error_class": null,
  "error_code": null,
  "error_message_private": null,
  "deployed_revision": "unknown",
  "schema_version": null,
  "migration_version": null,
  "scheduler_state": "active",
  "backup_state": "not_applicable",
  "backup_age_seconds": null,
  "storage_bytes": null,
  "storage_growth_bytes_24h": null,
  "database_size_bytes": null,
  "data_directory_size_bytes": null,
  "prune_status": "not_applicable",
  "incident_state": "none",
  "heartbeat_at": "2026-07-08T11:57:00Z",
  "disk_free_bytes": null,
  "disk_usage_pct": null,
  "producer_version": "0.2.0-adapter",
  "project_environment": "production"
}
