{
  "contract_version": 2,
  "generated_at": "2026-07-08T05:15:00Z",
  "project": "traderie",
  "workflow": "snapshot",
  "workflow_id": "traderie/snapshot",
  "run_id": "c3d4e5f6-58cc-4372-a567-0e02b2c3d479",
  "status": "fail",
  "started_at": "2026-07-08T05:00:00Z",
  "finished_at": "2026-07-08T05:12:00Z",
  "last_success_at": "2026-07-07T23:00:00Z",
  "expected_cadence_seconds": 21600,
  "freshness_seconds": 22500,
  "records_read": 1250,
  "records_written": 800,
  "records_rejected": 450,
  "backlog": 200,
  "retry_count": 3,
  "error_class": "ScraperError",
  "error_code": "E_CLOUDSCRAPER_BLOCKED",
  "error_message_private": "Cloudscraper returned 503 for target segment hardcore",
  "deployed_revision": "b3b70a0",
  "schema_version": 17,
  "migration_version": "20260706_017_grant_reader_health_select",
  "scheduler_state": "active",
  "backup_state": "ok",
  "backup_age_seconds": 7200,
  "storage_bytes": 10000000,
  "storage_growth_bytes_24h": 12000000,
  "database_size_bytes": 10000000,
  "data_directory_size_bytes": 500000,
  "prune_status": "ok",
  "incident_state": "active",
  "heartbeat_at": "2026-07-08T05:11:00Z",
  "disk_free_bytes": 6200000000,
  "disk_usage_pct": 84.0,
  "producer_version": "1.0.0",
  "project_environment": "production"
}
