{
  "contract_version": 2,
  "generated_at": "2026-07-08T07:05:00Z",
  "project": "reddit_ops",
  "workflow": "daily_collection",
  "workflow_id": "reddit_ops/daily_collection",
  "run_id": "f47ac10b-58cc-4372-a567-0e02b2c3d479",
  "status": "ok",
  "started_at": "2026-07-08T07:00:00Z",
  "finished_at": "2026-07-08T07:04:32Z",
  "last_success_at": "2026-07-08T07:04:32Z",
  "expected_cadence_seconds": 86400,
  "freshness_seconds": 28,
  "records_read": 52,
  "records_written": 48,
  "records_rejected": 0,
  "backlog": 0,
  "retry_count": 0,
  "error_class": null,
  "error_code": null,
  "error_message_private": null,
  "deployed_revision": "7047400",
  "schema_version": 6,
  "migration_version": "0006_create_health_views",
  "scheduler_state": "active",
  "backup_state": "ok",
  "backup_age_seconds": 3600,
  "storage_bytes": 2900000000,
  "storage_growth_bytes_24h": 15000000,
  "database_size_bytes": 48000000,
  "data_directory_size_bytes": null,
  "prune_status": "not_applicable",
  "incident_state": "none",
  "heartbeat_at": "2026-07-08T07:04:30Z",
  "disk_free_bytes": 6200000000,
  "disk_usage_pct": 84.2,
  "producer_version": "1.0.0",
  "project_environment": "production"
}
